{
  "$schema": "https://json-schema.org/draft/2020-12/schema",
  "$id": "alan_context.schema.json",
  "type": "object",
  "required": ["id", "created_at", "updated_at", "source", "status", "constraints"],
  "properties": {
    "id": { "type": "string" },
    "created_at": { "type": "string", "format": "date-time" },
    "updated_at": { "type": "string", "format": "date-time" },
    "source": { "type": "string" },
    "status": { "type": "string", "enum": ["active", "archived"] },
    "constraints": { "type": "array", "items": { "type": "string" } },
    "execution_preferences": { "type": "array", "items": { "type": "string" } },
    "anti_patterns": { "type": "array", "items": { "type": "string" } }
  }
}
